{
  "_comment": "게시기(import) 설정 예시. question_sets의 content_hash는 자리 표시이며 실제 값이 아니다. 행 형식은 C1 실제 파일로 확인(docs/design.md 부록 B).",
  "dataset_id": "ds-import-example",
  "input_dir": "../work/import-input",
  "survey_schema_dir": "../../survey-service/schema",
  "question_sets": [
    {
      "id": "qs-external",
      "version": "1",
      "content_hash": "sha256:0000000000000000000000000000000000000000000000000000000000000000"
    }
  ],
  "source_label": "dataset-team-example",
  "action_rules_version": "2",
  "tolerance": {
    "max_invalid_rows": 0,
    "max_invalid_rate": 0.0
  },
  "output": {
    "work_dir": "../work/import",
    "store": {
      "kind": "file",
      "root": "../work/store"
    }
  }
}
